[{"id":"evidence-0011","type":"expert_report","source":"Bowery Appraisal","date":"December 20, 2019","excerpt":"The independent Bowery Appraisal, conducted as of December 20, 2019, valued the unit at $2.5 million.","full_reference":"The Price History","proceeding_ids":["proc-0001"],"related_claim_ids":["claim-0013"],"related_event_ids":["event-0028"],"provenance":"CHAPTER TWO: THE GOVERNANCE WAR (2019) | The Price History","reliability_level":"secondary_reference","notes_internal":null},{"id":"evidence-0012","type":"deposition","source":"Kornmeier deposition","date":"September 5, 2019","excerpt":"Kornmeier testified that he reviewed the Certificate of Occupancy and determined those were not legal bedrooms.","full_reference":"The Kornmeier Deposition","proceeding_ids":["proc-0001"],"related_claim_ids":["claim-0015","claim-0016","claim-0017"],"related_event_ids":["event-0008","event-0027"],"provenance":"CHAPTER TWO: THE GOVERNANCE WAR (2019) | The Kornmeier Deposition","reliability_level":"sworn_statement","notes_internal":null},{"id":"evidence-0013","type":"court_order","source":"Justice Perry Decision and Order","date":"June 29, 2021","excerpt":"On June 29, 2021, Justice W. Franc Perry issued a Decision and Order on the parties\u2019 cross-motions for summary judgment.","full_reference":"Justice Perry\u2019s Decision","proceeding_ids":["proc-0001"],"related_claim_ids":["claim-0018","claim-0019"],"related_event_ids":["event-0029","event-0035","event-0042"],"provenance":"CHAPTER TWO: THE GOVERNANCE WAR (2019) | Justice Perry\u2019s Decision","reliability_level":"primary_record","notes_internal":null},{"id":"evidence-0014","type":"court_order","source":"First Department decision","date":"May 24, 2022","excerpt":"The Appellate Division, First Department, largely affirmed Justice Perry\u2019s decision on May 24, 2022.","full_reference":"The First Department Affirms","proceeding_ids":["proc-0001"],"related_claim_ids":["claim-0020"],"related_event_ids":["event-0029","event-0031"],"provenance":"CHAPTER TWO: THE GOVERNANCE WAR (2019) | The First Department Affirms","reliability_level":"primary_record","notes_internal":null},{"id":"evidence-0015","type":"correspondence","source":"September 15, 2022 conference admission","date":"September 15, 2022","excerpt":"Giacovas acknowledged that the Bleichs had been using the cellar for bedrooms and sleeping.","full_reference":"The First Department Affirms","proceeding_ids":["proc-0001"],"related_claim_ids":[],"related_event_ids":["event-0032"],"provenance":"CHAPTER TWO: THE GOVERNANCE WAR (2019) | The First Department Affirms","reliability_level":"secondary_reference","notes_internal":null},{"id":"evidence-0016","type":"pleading","source":"2024 Verified Complaint","date":"June 21, 2024","excerpt":"The 2024 Complaint asserted six causes of action and demanded $20 million in compensatory damages.","full_reference":"The Stealth Filing","proceeding_ids":["proc-0002"],"related_claim_ids":[],"related_event_ids":["event-0034"],"provenance":"CHAPTER THREE: THE INJUNCTION (2024) | The Stealth Filing","reliability_level":"primary_record","notes_internal":null},{"id":"evidence-0017","type":"affidavit","source":"Bleich sworn affirmation re HVAC","date":"June 21, 2024","excerpt":"The rooftop HVAC \u201cprovides heating, ventilation, and air conditioning to Plaintiffs\u2019 residential unit.\u201d","full_reference":"The Stealth Filing","proceeding_ids":["proc-0002"],"related_claim_ids":["claim-0021"],"related_event_ids":["event-0002","event-0004","event-0008","event-0013","event-0015","event-0017","event-0019","event-0020","event-0021","event-0024","event-0026","event-0030","event-0036","event-0037","event-0046"],"provenance":"CHAPTER THREE: THE INJUNCTION (2024) | The Stealth Filing","reliability_level":"sworn_statement","notes_internal":null},{"id":"evidence-0018","type":"affidavit","source":"Reply Affirmation NYSCEF Doc. 94 ¶12","date":"September 18, 2024","excerpt":"\u201cthe Unit 1 HVAC provides heat to our home, which is necessary and critical...\u201d","full_reference":"The Six Proofs of Perjury","proceeding_ids":["proc-0002"],"related_claim_ids":["claim-0022","claim-0023","claim-0025"],"related_event_ids":["event-0046"],"provenance":"CHAPTER THREE: THE INJUNCTION (2024) | The Six Proofs of Perjury","reliability_level":"sworn_statement","notes_internal":null},{"id":"evidence-0019","type":"court_order","source":"Justice Rosado preliminary injunction order","date":"January 17, 2025","excerpt":"On January 17, 2025, Justice Rosado granted a preliminary injunction.","full_reference":"The Injunction","proceeding_ids":["proc-0002"],"related_claim_ids":["claim-0024"],"related_event_ids":["event-0029","event-0035","event-0042"],"provenance":"CHAPTER THREE: THE INJUNCTION (2024) | The Injunction","reliability_level":"primary_record","notes_internal":null},{"id":"evidence-0020","type":"correspondence","source":"Forensic damage audit","date":"January 2025","excerpt":"A forensic damage audit documented no fewer than 299 discrete failure points.","full_reference":"The Damage","proceeding_ids":["proc-0002"],"related_claim_ids":[],"related_event_ids":[],"provenance":"CHAPTER THREE: THE INJUNCTION (2024) | The Damage","reliability_level":"secondary_reference","notes_internal":null}]