[{"id":"evidence-0031","type":"court_order","source":"Medifast sanctions ruling","date":"2015","excerpt":"Judge Janis Sammartino found that Giacovas fabricated claims for maximum shock value.","full_reference":"The Giacovas Connection","proceeding_ids":[],"related_claim_ids":["claim-0038"],"related_event_ids":[],"provenance":"CHAPTER SIX: THE MAN BEHIND THE SCHEME | The Giacovas Connection","reliability_level":"primary_record","notes_internal":null},{"id":"evidence-0032","type":"correspondence","source":"Table of Lies","date":"March 2026","excerpt":"The following tables compile every material misstatement identified in the court record.","full_reference":"A Comprehensive Forensic Comparison Across All Four Proceedings","proceeding_ids":[],"related_claim_ids":["claim-0039"],"related_event_ids":[],"provenance":"CHAPTER SEVEN: THE TABLE OF LIES | A Comprehensive Forensic Comparison Across All Four Proceedings","reliability_level":"secondary_reference","notes_internal":null},{"id":"evidence-0033","type":"correspondence","source":"Master chronology table","date":"March 2026","excerpt":"A Complete Timeline of Events: 1995\u20132026.","full_reference":"A Complete Timeline of Events: 1995\u20132026","proceeding_ids":[],"related_claim_ids":[],"related_event_ids":[],"provenance":"CHAPTER TEN: MASTER CHRONOLOGY | A Complete Timeline of Events: 1995\u20132026","reliability_level":"secondary_reference","notes_internal":null},{"id":"evidence-0034","type":"correspondence","source":"Compass floor plans","date":"2019","excerpt":"Compass real estate floor plans depict the boiler room.","full_reference":"The Six Proofs of Perjury","proceeding_ids":["proc-0002"],"related_claim_ids":["claim-0025","claim-0022","claim-0026"],"related_event_ids":["event-0007"],"provenance":"CHAPTER THREE: THE INJUNCTION (2024) | The Six Proofs of Perjury","reliability_level":"secondary_reference","notes_internal":null},{"id":"evidence-0035","type":"correspondence","source":"Mechanical schematic","date":"2026","excerpt":"Annotated mechanical schematic states: \u201cPreviously incorrectly identified as Unit 1\u2019s HVAC.\u201d","full_reference":"The Physical Evidence","proceeding_ids":[],"related_claim_ids":["claim-0042","claim-0043","claim-0021"],"related_event_ids":[],"provenance":"CHAPTER TWELVE: THE GHOST MACHINE | The Physical Evidence","reliability_level":"secondary_reference","notes_internal":null},{"id":"evidence-0036","type":"correspondence","source":"NY Brownstone inspection","date":"November 6\u20137, 2025","excerpt":"Both rooftop HVAC units were completely non-functional.","full_reference":"The Six Proofs of Perjury","proceeding_ids":["proc-0002"],"related_claim_ids":["claim-0025","claim-0026","claim-0021","claim-0022"],"related_event_ids":["event-0033","event-0040"],"provenance":"CHAPTER THREE: THE INJUNCTION (2024) | The Six Proofs of Perjury","reliability_level":"secondary_reference","notes_internal":null},{"id":"evidence-0037","type":"expert_report","source":"Elcherbini February 26, 2026 letter","date":"February 26, 2026","excerpt":"Unit 1 has a gas boiler in the cellar as its primary heating source.","full_reference":"The Expert Assessments","proceeding_ids":[],"related_claim_ids":["claim-0045","claim-0046","claim-0021","claim-0022","claim-0025","claim-0026"],"related_event_ids":["event-0045"],"provenance":"CHAPTER TWELVE: THE GHOST MACHINE | The Expert Assessments","reliability_level":"secondary_reference","notes_internal":null},{"id":"evidence-0038","type":"affidavit","source":"Powers supplemental affirmation","date":"March 2026","excerpt":"Powers confirmed the non-functional status of the rooftop equipment and misidentification of CU-3.","full_reference":"The Expert Assessments","proceeding_ids":[],"related_claim_ids":["claim-0021","claim-0022","claim-0025","claim-0026"],"related_event_ids":["event-0046"],"provenance":"CHAPTER TWELVE: THE GHOST MACHINE | The Expert Assessments","reliability_level":"sworn_statement","notes_internal":null},{"id":"evidence-0039","type":"affidavit","source":"Vogt sworn affirmation","date":"March 2, 2026","excerpt":"Vogt stated Bleich \u201csupplements with wall units.\u201d","full_reference":"The Expert Assessments","proceeding_ids":[],"related_claim_ids":["claim-0044","claim-0022","claim-0025","claim-0026"],"related_event_ids":["event-0046"],"provenance":"CHAPTER TWELVE: THE GHOST MACHINE | The Expert Assessments","reliability_level":"sworn_statement","notes_internal":null}]