[{"id":"evidence-0001","type":"correspondence","source":"October 15, 2018 board meeting minutes","date":"October 16, 2018","excerpt":"Minutes state Morgan Brill and Michael Bleich were present and record election of co-Presidents, Secretary, and Resident Managers.","full_reference":"The October 15, 2018 \u201cBoard Meeting\u201d: A Fabrication","proceeding_ids":[],"related_claim_ids":[],"related_event_ids":["event-0009","event-0033"],"provenance":"CHAPTER ONE: HOW IT ALL STARTED | The October 15, 2018 \u201cBoard Meeting\u201d: A Fabrication","reliability_level":"secondary_reference","notes_internal":null},{"id":"evidence-0002","type":"correspondence","source":"ROFR waiver certificates","date":"October 17, 2018","excerpt":"On October 17, 2018, the Board issued certificates purporting to waive the ROFR as to Brill\u2019s sale of Unit 2 to 13 Harrison LLC and sales of all units through December 31, 2019.","full_reference":"The October 15, 2018 \u201cBoard Meeting\u201d: A Fabrication","proceeding_ids":[],"related_claim_ids":["claim-0002"],"related_event_ids":["event-0010"],"provenance":"CHAPTER ONE: HOW IT ALL STARTED | The October 15, 2018 \u201cBoard Meeting\u201d: A Fabrication","reliability_level":"secondary_reference","notes_internal":null},{"id":"evidence-0003","type":"correspondence","source":"Morgan Brill correspondence","date":"September 3, 2024","excerpt":"\u201cWe never had an in-person board meeting. We just talked on the phone.\u201d","full_reference":"Morgan Brill\u2019s Testimony","proceeding_ids":[],"related_claim_ids":["claim-0001","claim-0002","claim-0003","claim-0004","claim-0005","claim-0006"],"related_event_ids":["event-0003","event-0006","event-0012","event-0022"],"provenance":"CHAPTER ONE: HOW IT ALL STARTED | Morgan Brill\u2019s Testimony","reliability_level":"secondary_reference","notes_internal":null},{"id":"evidence-0004","type":"correspondence","source":"Morgan Brill correspondence on ROFR","date":"September 3, 2024","excerpt":"\u201cI can assure you that never happened.\u201d","full_reference":"Morgan Brill\u2019s Testimony","proceeding_ids":[],"related_claim_ids":["claim-0001","claim-0002","claim-0003","claim-0004","claim-0005","claim-0006"],"related_event_ids":["event-0003","event-0006","event-0012","event-0022"],"provenance":"CHAPTER ONE: HOW IT ALL STARTED | Morgan Brill\u2019s Testimony","reliability_level":"secondary_reference","notes_internal":null},{"id":"evidence-0005","type":"email","source":"Morgan Brill resignation email","date":"October 19, 2018","excerpt":"\u201cas of yesterday I am officially resigning as Co-President of the board of 13 Harrison St\u201d","full_reference":"The Resignation Sequence","proceeding_ids":[],"related_claim_ids":["claim-0007"],"related_event_ids":["event-0003","event-0006","event-0012","event-0013","event-0019","event-0021","event-0022","event-0024","event-0038"],"provenance":"CHAPTER ONE: HOW IT ALL STARTED | The Resignation Sequence","reliability_level":"primary_record","notes_internal":null},{"id":"evidence-0006","type":"email","source":"December 1, 2018 email from Michael Bleich","date":"December 1, 2018","excerpt":"\u201cTom is going to do some light work on the skylight air conditioning and ventilation above our back room...\u201d","full_reference":"December 1, 2018: The Revelations in One Email","proceeding_ids":[],"related_claim_ids":["claim-0009","claim-0010"],"related_event_ids":["event-0012","event-0013","event-0019","event-0021","event-0022","event-0024","event-0038"],"provenance":"CHAPTER ONE: HOW IT ALL STARTED | December 1, 2018: The Revelations in One Email","reliability_level":"primary_record","notes_internal":null},{"id":"evidence-0007","type":"email","source":"July 7, 2019 email from Michael Bleich","date":"July 7, 2019","excerpt":"\u201cThere is a water leak coming from your unit into ours...\u201d","full_reference":"The Water Leak: July 2019","proceeding_ids":[],"related_claim_ids":["claim-0011"],"related_event_ids":["event-0012","event-0013","event-0019","event-0021","event-0022","event-0024","event-0038"],"provenance":"CHAPTER ONE: HOW IT ALL STARTED | The Water Leak: July 2019","reliability_level":"primary_record","notes_internal":null},{"id":"evidence-0008","type":"pleading","source":"Amended Complaint in 651188/2019","date":"April 25, 2019","excerpt":"The Amended Complaint, dated April 25, 2019, sought declaratory and injunctive relief on four causes of action.","full_reference":"The Filing","proceeding_ids":["proc-0001"],"related_claim_ids":[],"related_event_ids":["event-0034"],"provenance":"CHAPTER TWO: THE GOVERNANCE WAR (2019) | The Filing","reliability_level":"primary_record","notes_internal":null},{"id":"evidence-0009","type":"pleading","source":"Answer and Counterclaims in 651188/2019","date":"May 15, 2019","excerpt":"Bleich filed an Answer and Counterclaims on May 15, 2019.","full_reference":"The Filing","proceeding_ids":["proc-0001"],"related_claim_ids":[],"related_event_ids":[],"provenance":"CHAPTER TWO: THE GOVERNANCE WAR (2019) | The Filing","reliability_level":"primary_record","notes_internal":null},{"id":"evidence-0010","type":"email","source":"February 28, 2019 email from Michael Bleich","date":"February 28, 2019","excerpt":"\u201cWe are getting a lot of interest currently around the new asking price of $3.9mm.\u201d","full_reference":"Bleich\u2019s Immediate Response","proceeding_ids":["proc-0001"],"related_claim_ids":["claim-0012","claim-0013","claim-0014"],"related_event_ids":["event-0012","event-0013","event-0019","event-0021","event-0022","event-0024","event-0038"],"provenance":"CHAPTER TWO: THE GOVERNANCE WAR (2019) | Bleich\u2019s Immediate Response","reliability_level":"primary_record","notes_internal":null}]