[{"id":"evidence-0021","type":"expert_report","source":"HLZAE report","date":"2025","excerpt":"The temporary roof was observed to be defective with bubbling, blistering, and signs of delamination.","full_reference":"The Damage","proceeding_ids":["proc-0002"],"related_claim_ids":["claim-0027"],"related_event_ids":["event-0026"],"provenance":"CHAPTER THREE: THE INJUNCTION (2024) | The Damage","reliability_level":"secondary_reference","notes_internal":null},{"id":"evidence-0022","type":"video","source":"Sheetrock concealment video","date":"June 2024","excerpt":"Video surveillance captured workers erecting sheetrock walls and cardboard over the illegal cellar bedroom and bathroom doors.","full_reference":"Evidence Tampering: The Sheetrock Cover-Up","proceeding_ids":["proc-0002"],"related_claim_ids":[],"related_event_ids":["event-0033"],"provenance":"CHAPTER THREE: THE INJUNCTION (2024) | Evidence Tampering: The Sheetrock Cover-Up","reliability_level":"primary_record","notes_internal":null},{"id":"evidence-0023","type":"correspondence","source":"13 H Valuation.xlsx","date":"May 24, 2025","excerpt":"Bleich\u2019s own Cluster 1 analysis valued Unit 1 at between $4.7 million and $4.9 million.","full_reference":"The Extortion Premium","proceeding_ids":["proc-0003"],"related_claim_ids":[],"related_event_ids":[],"provenance":"CHAPTER FOUR: THE EXTORTION (2025) | The Extortion Premium","reliability_level":"secondary_reference","notes_internal":null},{"id":"evidence-0024","type":"email","source":"May 24, 2025 extortion email","date":"May 24, 2025","excerpt":"\u201cthe minimum price I would be looking to get ... is $6 million ... and $8 million ...\u201d","full_reference":"The Extortion Premium","proceeding_ids":["proc-0003"],"related_claim_ids":["claim-0028","claim-0029"],"related_event_ids":[],"provenance":"CHAPTER FOUR: THE EXTORTION (2025) | The Extortion Premium","reliability_level":"primary_record","notes_internal":null},{"id":"evidence-0025","type":"correspondence","source":"Term Sheet (Final Draft)","date":"September 26, 2025","excerpt":"Section 5(a) provided that the preliminary injunction order \u201cshall remain in effect throughout any stay(s)\u201d","full_reference":"The Term Sheet: Section 5(a)","proceeding_ids":["proc-0003"],"related_claim_ids":["claim-0030","claim-0031"],"related_event_ids":["event-0033","event-0037","event-0039"],"provenance":"CHAPTER FOUR: THE EXTORTION (2025) | The Term Sheet: Section 5(a)","reliability_level":"secondary_reference","notes_internal":null},{"id":"evidence-0026","type":"email","source":"August 27, 2025 email to counsel","date":"August 27, 2025","excerpt":"\u201cthe house is leaking and the roof can\u2019t be completed. Let\u2019s take all his demands off the table and conclude this.\u201d","full_reference":"The Victim\u2019s Duress","proceeding_ids":["proc-0003"],"related_claim_ids":["claim-0032"],"related_event_ids":["event-0012","event-0013","event-0019","event-0021","event-0022","event-0024","event-0038"],"provenance":"CHAPTER FOUR: THE EXTORTION (2025) | The Victim\u2019s Duress","reliability_level":"primary_record","notes_internal":null},{"id":"evidence-0027","type":"correspondence","source":"April 30, 2021 WhatsApp messages","date":"April 30, 2021","excerpt":"\u201cThere was strong interest from buyers at 3.4\u201d","full_reference":"The WhatsApp Contrast","proceeding_ids":["proc-0003"],"related_claim_ids":["claim-0033","claim-0034"],"related_event_ids":["event-0030"],"provenance":"CHAPTER FOUR: THE EXTORTION (2025) | The WhatsApp Contrast","reliability_level":"secondary_reference","notes_internal":null},{"id":"evidence-0028","type":"court_order","source":"Justice Kim OSC","date":"January 7, 2026","excerpt":"Justice Kim signed an Order to Show Cause restraining the Bleichs from using the cellar space of Unit 1 for residential and/or living purposes.","full_reference":"The 2025 Action","proceeding_ids":["proc-0003"],"related_claim_ids":[],"related_event_ids":["event-0029","event-0035","event-0042"],"provenance":"CHAPTER FOUR: THE EXTORTION (2025) | The 2025 Action","reliability_level":"primary_record","notes_internal":null},{"id":"evidence-0029","type":"pleading","source":"Enhanced Verified Complaint","date":"Early 2026","excerpt":"A new action was commenced under Index No. 152171/2026 ... asserting eleven causes of action.","full_reference":"The Enhanced Verified Complaint","proceeding_ids":["proc-0004"],"related_claim_ids":["claim-0035"],"related_event_ids":["event-0034"],"provenance":"CHAPTER FIVE: THE RECKONING (2026) | The Enhanced Verified Complaint","reliability_level":"primary_record","notes_internal":null},{"id":"evidence-0030","type":"correspondence","source":"FINRA/NASDAQ enforcement record","date":"2015","excerpt":"Scout Trading would be fined $3 million for systematic violations of Regulation SHO.","full_reference":"Scout Trading","proceeding_ids":[],"related_claim_ids":["claim-0036","claim-0037"],"related_event_ids":["event-0009"],"provenance":"CHAPTER SIX: THE MAN BEHIND THE SCHEME | Scout Trading","reliability_level":"secondary_reference","notes_internal":null}]